{
  "$schema": "https://json-schema.org/draft/2020-12/schema",
  "type": "object",
  "additionalProperties": false,
  "required": [
    "timezone",
    "start_date",
    "days",
    "blocked",
    "items"
  ],
  "properties": {
    "timezone": {
      "type": "string",
      "minLength": 1,
      "description": "An IANA time zone name, such as Europe/Athens. The calendar is shown in this time zone."
    },
    "start_date": {
      "type": "string",
      "format": "date",
      "description": "The first day the calendar shows, as YYYY-MM-DD."
    },
    "days": {
      "type": "integer",
      "minimum": 1,
      "maximum": 14,
      "description": "How many days the calendar shows, from 1 to 14."
    },
    "heading": {
      "type": "string",
      "maxLength": 2000,
      "deprecated": true,
      "description": "Accepted for compatibility; the compact header displays the review title supplied via pinrail submit --title."
    },
    "description": {
      "type": "string",
      "maxLength": 2000,
      "deprecated": true,
      "description": "Accepted for compatibility; the compact header displays the review title supplied via pinrail submit --title."
    },
    "blocked": {
      "type": "array",
      "maxItems": 500,
      "items": {
        "type": "object",
        "additionalProperties": false,
        "required": [
          "id",
          "title",
          "start",
          "end"
        ],
        "properties": {
          "id": {
            "type": "string",
            "pattern": "^[a-zA-Z0-9][a-zA-Z0-9_-]*$",
            "maxLength": 100,
            "description": "An ID unique across every item, option and blocked event: a letter or digit, then letters, digits, _ or -."
          },
          "title": {
            "type": "string",
            "maxLength": 2000,
            "description": "What the event is, as the calendar shows it."
          },
          "start": {
            "type": "string",
            "format": "date-time",
            "pattern": "^\\d{4}-\\d{2}-\\d{2}T\\d{2}:\\d{2}:\\d{2}(?:\\.\\d+)?(?:Z|[+-]\\d{2}:\\d{2})$",
            "description": "A date and time with an explicit UTC offset, such as 2026-10-02T09:00:00+03:00."
          },
          "end": {
            "type": "string",
            "format": "date-time",
            "pattern": "^\\d{4}-\\d{2}-\\d{2}T\\d{2}:\\d{2}:\\d{2}(?:\\.\\d+)?(?:Z|[+-]\\d{2}:\\d{2})$",
            "description": "A date and time with an explicit UTC offset, such as 2026-10-02T09:00:00+03:00. It must be after the start."
          }
        }
      },
      "description": "Events that are already booked, shown as busy time. Send an empty list when nothing is booked."
    },
    "items": {
      "type": "array",
      "maxItems": 50,
      "items": {
        "type": "object",
        "additionalProperties": false,
        "required": [
          "id",
          "title",
          "options"
        ],
        "properties": {
          "id": {
            "type": "string",
            "pattern": "^[a-zA-Z0-9][a-zA-Z0-9_-]*$",
            "maxLength": 100,
            "description": "An ID unique across every item, option and blocked event: a letter or digit, then letters, digits, _ or -."
          },
          "title": {
            "type": "string",
            "maxLength": 2000,
            "description": "What the activity is."
          },
          "subtitle": {
            "type": "string",
            "maxLength": 2000,
            "description": "A second line shown under the title, such as a place or a person."
          },
          "icon": {
            "enum": ["calendar", "stethoscope", "user-round", "users", "utensils", "circle-dot", "coffee", "briefcase", "plane", "car", "dumbbell", "heart-pulse", "graduation-cap", "baby", "dog", "house", "phone", "video", "music", "book-open", "shopping-cart", "scissors", "wrench", "party-popper", "bike"],
            "description": "The activity's icon, one of those the plugin carries; calendar when none is given."
          },
          "options": {
            "type": "array",
            "maxItems": 100,
            "items": {
              "type": "object",
              "additionalProperties": false,
              "required": [
                "id",
                "start",
                "end"
              ],
              "properties": {
                "id": {
                  "type": "string",
                  "pattern": "^[a-zA-Z0-9][a-zA-Z0-9_-]*$",
                  "maxLength": 100,
                  "description": "An ID unique across every item, option and blocked event: a letter or digit, then letters, digits, _ or -."
                },
                "start": {
                  "type": "string",
                  "format": "date-time",
                  "pattern": "^\\d{4}-\\d{2}-\\d{2}T\\d{2}:\\d{2}:\\d{2}(?:\\.\\d+)?(?:Z|[+-]\\d{2}:\\d{2})$",
                  "description": "A date and time with an explicit UTC offset, such as 2026-10-02T09:00:00+03:00."
                },
                "end": {
                  "type": "string",
                  "format": "date-time",
                  "pattern": "^\\d{4}-\\d{2}-\\d{2}T\\d{2}:\\d{2}:\\d{2}(?:\\.\\d+)?(?:Z|[+-]\\d{2}:\\d{2})$",
                  "description": "A date and time with an explicit UTC offset, such as 2026-10-02T09:00:00+03:00. It must be after the start."
                },
                "location": {
                  "type": "string",
                  "maxLength": 2000
                },
                "detail": {
                  "type": "string",
                  "maxLength": 2000
                },
                "recommended": {
                  "type": "boolean"
                }
              }
            },
            "description": "The suggested times for this activity. Each one must fall within the days the calendar shows."
          }
        }
      },
      "description": "The activities to schedule. For each one, the person picks one of the suggested times or leaves it for the agent."
    }
  }
}
