{
  "timezone": "Europe/Athens",
  "start_date": "2026-09-21",
  "days": 5,
  "blocked": [
    {
      "id": "team-sync",
      "title": "Team sync",
      "start": "2026-09-21T09:00:00+03:00",
      "end": "2026-09-21T10:00:00+03:00"
    },
    {
      "id": "deep-work",
      "title": "Focus time",
      "start": "2026-09-21T13:00:00+03:00",
      "end": "2026-09-21T15:00:00+03:00"
    }
  ],
  "items": [
    {
      "id": "doctor",
      "title": "Doctor appointment",
      "subtitle": "Annual check-up · 1 hour",
      "icon": "stethoscope",
      "options": [
        {
          "id": "doctor-mon",
          "start": "2026-09-21T10:00:00+03:00",
          "end": "2026-09-21T11:00:00+03:00",
          "location": "Dr. Elena Papas · Kolonaki",
          "detail": "€60 · Annual check-up",
          "recommended": true
        },
        {
          "id": "doctor-tue",
          "start": "2026-09-22T16:00:00+03:00",
          "end": "2026-09-22T17:00:00+03:00",
          "location": "Dr. Elena Papas · Kolonaki",
          "detail": "€60 · Annual check-up",
          "recommended": false
        }
      ]
    }
  ]
}
